{
  "decision": {
    "executed_action": "observe",
    "fallback_used": false,
    "recommended_strategy": "observe",
    "unsupported_strategy": null
  },
  "llm_quality_metrics": {
    "decision_latency_ms": 0.06940006278455257,
    "fallback_to_observe_rate": 0.0,
    "reasoning_action_mismatch_rate": 0.0,
    "repeated_run_consistency": 1.0,
    "unsupported_action_rate": 0.0,
    "valid_executable_action_rate": 1.0,
    "valid_json_rate": 1.0
  },
  "model_type": "llm_only",
  "notes": [],
  "overhead_metrics": {
    "active_policy_actions_after": 0.0,
    "active_policy_actions_before": 0.0,
    "flow_rules_installed_after": 0.0,
    "flow_rules_installed_before": 0.0,
    "meters_added_after": 0.0,
    "meters_added_before": 0.0,
    "ryu_apply_duration_ms_after": 0.0,
    "ryu_apply_duration_ms_before": 0.0
  },
  "qos_metrics": {
    "edge_to_cloud_latency_ms_after": 0.0,
    "edge_to_cloud_latency_ms_before": 0.0,
    "gateway_to_worker_latency_ms_after": 0.0,
    "gateway_to_worker_latency_ms_before": 0.0,
    "message_loss_rate_after": 0.0,
    "message_loss_rate_before": 0.0,
    "queue_length_after": 0.0,
    "queue_length_before": 0.0,
    "sensor_to_gateway_latency_ms_after": 0.0,
    "sensor_to_gateway_latency_ms_before": 0.0,
    "throughput_bps_after": 0.0,
    "throughput_bps_before": 0.0
  },
  "raw_state_after": {
    "core_data": {},
    "experiment_summary": {},
    "normalized_state": {
      "active_pool": {
        "active_strategies": [],
        "enabled": false,
        "pool_strategies": []
      },
      "allowed_actions": [
        "observe",
        "quarantine_sensor",
        "rate_limit",
        "reroute_traffic",
        "release_sensor"
      ],
      "attack_context": {
        "caldera_result": null,
        "mulval_path": [
          "sen4",
          "edge2_gw",
          "edge2_vm_s4",
          "cloud_db"
        ],
        "risk_score": 0.82
      },
      "controller_context": {
        "active_policy_actions": 0,
        "flow_rules_installed": 0,
        "meters_added": 0,
        "ryu_apply_duration_ms": 0.0
      },
      "entry_node": "sen4",
      "qos_context": {
        "edge_to_cloud_latency_ms": 0.0,
        "gateway_to_worker_latency_ms": 0.0,
        "message_loss_rate": 0.0,
        "queue_length": 0,
        "sensor_to_gateway_latency_ms": 0.0,
        "throughput_bps": 0.0
      },
      "scenario_id": "sen4_edge2_clouddb",
      "security_context": {
        "attack_effect_success": false,
        "cloud_seen": false,
        "defense_success": false,
        "gateway_seen": false,
        "worker_seen": false
      },
      "target_asset": "cloud_db",
      "timestamp": ""
    },
    "ryu_metrics_text": "",
    "ryu_status_data": {}
  },
  "raw_state_before": {
    "core_data": {},
    "experiment_summary": {},
    "normalized_state": {
      "active_pool": {
        "active_strategies": [],
        "enabled": false,
        "pool_strategies": []
      },
      "allowed_actions": [
        "observe",
        "quarantine_sensor",
        "rate_limit",
        "reroute_traffic",
        "release_sensor"
      ],
      "attack_context": {
        "caldera_result": null,
        "mulval_path": [
          "sen4",
          "edge2_gw",
          "edge2_vm_s4",
          "cloud_db"
        ],
        "risk_score": 0.82
      },
      "controller_context": {
        "active_policy_actions": 0,
        "flow_rules_installed": 0,
        "meters_added": 0,
        "ryu_apply_duration_ms": 0.0
      },
      "entry_node": "sen4",
      "qos_context": {
        "edge_to_cloud_latency_ms": 0.0,
        "gateway_to_worker_latency_ms": 0.0,
        "message_loss_rate": 0.0,
        "queue_length": 0,
        "sensor_to_gateway_latency_ms": 0.0,
        "throughput_bps": 0.0
      },
      "scenario_id": "sen4_edge2_clouddb",
      "security_context": {
        "attack_effect_success": false,
        "cloud_seen": false,
        "defense_success": false,
        "gateway_seen": false,
        "worker_seen": false
      },
      "target_asset": "cloud_db",
      "timestamp": ""
    },
    "ryu_metrics_text": "",
    "ryu_status_data": {}
  },
  "scenario_id": "sen4_edge2_clouddb",
  "security_metrics": {
    "attack_effect_success_after": 0.0,
    "attack_effect_success_before": 0.0,
    "cloud_seen_after": 0.0,
    "cloud_seen_before": 0.0,
    "defense_success_after": 0.0,
    "defense_success_before": 0.0,
    "gateway_seen_after": 0.0,
    "gateway_seen_before": 0.0,
    "risk_score": 0.82,
    "worker_seen_after": 0.0,
    "worker_seen_before": 0.0
  },
  "seed": 42,
  "timestamps": {
    "decision_at": "2026-04-21T12:04:50.918002+00:00",
    "executed_at": "2026-04-21T12:04:50.918051+00:00",
    "observed_at": "2026-04-21T12:04:50.918053+00:00",
    "started_at": "2026-04-21T12:04:50.907796+00:00"
  },
  "trial_id": "trial_43676d00ebbc"
}
